{
  "contract_version": "1.1",
  "contestant": "10",
  "generated_at": "2026-08-28T02:21:18.758465+00:00",
  "tools": [
    "summarize.py",
    "extract_configs.py",
    "extract_sessions.py",
    "generate_agent_report.py",
    "record_agent_results.py"
  ],
  "artifacts": {
    "agent_scores.json": {
      "artifact_kind": "json",
      "schema": "agent_scores.schema.json",
      "sha256": "700748b23fcb04745c92a464d222c9efebd23eeb420927610ed7f75f0495447e",
      "bytes": 11678
    },
    "configs.json": {
      "artifact_kind": "json",
      "schema": "configs.schema.json",
      "sha256": "0633dc49ea1cead72cedf02af56609f633c086bd31be5606927232980f3e4457",
      "bytes": 999548
    },
    "env_snapshot.json": {
      "artifact_kind": "json",
      "schema": "env_snapshot.schema.json",
      "sha256": "b66be812531509e20a3c9254a9bcbceae13e7108bba478a18423a393f926ec1d",
      "bytes": 5389
    },
    "expenses.json": {
      "artifact_kind": "json",
      "schema": "expenses.schema.json",
      "sha256": "eb8d083041d55e6e7fa330d1c99489d547d9d98329e7a4cdbd9f904b2faf795b",
      "bytes": 35359
    },
    "measurements.json": {
      "artifact_kind": "json",
      "schema": "measurements.schema.json",
      "sha256": "d1067c0cf53186d3ce7ae4f2648dee03d937b8d47413fb0b5557af327bbaddba",
      "bytes": 106064
    },
    "metadata.json": {
      "artifact_kind": "json",
      "schema": "metadata.schema.json",
      "sha256": "578177c2a0d58867683270017617f08f4e6548efb79e562bc66f1317d127dcea",
      "bytes": 72992
    },
    "report.pdf": {
      "artifact_kind": "binary",
      "schema": null,
      "sha256": "aa80571767fef756fc31156d41bae9e673f7dffb85af5546076a7e295df994cd",
      "bytes": 3655810,
      "media_type": "application/pdf"
    },
    "report_pdf.json": {
      "artifact_kind": "json",
      "schema": "report_pdf.schema.json",
      "sha256": "b7db38a80173d5a2c4fd465c2aaae959030f65ac0b86942c567d4a343d3dc5dc",
      "bytes": 1265
    },
    "review_cfd.json": {
      "artifact_kind": "json",
      "schema": "review.schema.json",
      "sha256": "ea4e2ed8e16381bf5e11b0881d01f373c5fe9549f711207917ad4316a63de510",
      "bytes": 3382
    },
    "review_code.json": {
      "artifact_kind": "json",
      "schema": "review.schema.json",
      "sha256": "15302987113f55196bb5db1d42b23ff2c895b2a9c1e0d3120b6bd81ef8992db9",
      "bytes": 3071
    },
    "review_results.json": {
      "artifact_kind": "json",
      "schema": "review.schema.json",
      "sha256": "7f6b4d34ad870059d0b089dc5dcd342c6a3693a97aaa24be11a25173bb74b7dc",
      "bytes": 1872
    },
    "sessions.json": {
      "artifact_kind": "json",
      "schema": "sessions.schema.json",
      "sha256": "8cf95b1a7531c68d397055ae915c96dab7f0bdfd9aeb1884a360c43f6c74f34c",
      "bytes": 477616
    },
    "summary.json": {
      "artifact_kind": "json",
      "schema": "summary.schema.json",
      "sha256": "b5d18c4352d15a14930965361c96065e0aaceed250e3b60a2c1b65df1b545dec",
      "bytes": 237023
    }
  }
}
