{
  "contract_version": "1.1",
  "contestant": "sonnet5-02",
  "generated_at": "2026-09-05T04:47:01.015634+00:00",
  "tools": [
    "summarize.py",
    "extract_configs.py",
    "extract_sessions.py",
    "generate_agent_report.py",
    "record_agent_results.py"
  ],
  "artifacts": {
    "agent_scores.json": {
      "artifact_kind": "json",
      "schema": "agent_scores.schema.json",
      "sha256": "e2aa5864badcd86d07a153202a42010924bc5eb5fb8b45c2077e395d1872dbdd",
      "bytes": 15006
    },
    "configs.json": {
      "artifact_kind": "json",
      "schema": "configs.schema.json",
      "sha256": "1a1f9458af3b62ba8e14195ef915ccb9a29b96780c69031ddc7ffc24b3620610",
      "bytes": 666410
    },
    "env_snapshot.json": {
      "artifact_kind": "json",
      "schema": "env_snapshot.schema.json",
      "sha256": "7fe09890e00386418383be0e68ce16159898d9438a66fe0553fc799ba19af1bc",
      "bytes": 5916
    },
    "expenses.json": {
      "artifact_kind": "json",
      "schema": "expenses.schema.json",
      "sha256": "913d7dd328bebb9a3e6952d78482a5c61f573e01a495297ea09fae29759d0c8f",
      "bytes": 22744
    },
    "measurements.json": {
      "artifact_kind": "json",
      "schema": "measurements.schema.json",
      "sha256": "94fa43b0f71048ef140bda47ba3eb4fca1a0476bc31a83c079f42756b4a43055",
      "bytes": 34691
    },
    "metadata.json": {
      "artifact_kind": "json",
      "schema": "metadata.schema.json",
      "sha256": "412f2d30cbffacfb3926df88910ecd31086885bc5181d93a8e8c9bf72981059c",
      "bytes": 63632
    },
    "report.pdf": {
      "artifact_kind": "binary",
      "schema": null,
      "sha256": "6a2ab40a75bf7144491cfb8052f3dfbdd1117e7f5ebf9521c1521fca8c3fd741",
      "bytes": 352391,
      "media_type": "application/pdf"
    },
    "report_pdf.json": {
      "artifact_kind": "json",
      "schema": "report_pdf.schema.json",
      "sha256": "e054b1d2546d903db9c45df712a0caeeb799ed677ec3a420740f7dc70e17ab5a",
      "bytes": 1022
    },
    "review_cfd.json": {
      "artifact_kind": "json",
      "schema": "review.schema.json",
      "sha256": "d59bad177192c1686d6c0c4f6827d1c4282dac63395f13a76aa2933d5a8c94ff",
      "bytes": 4222
    },
    "review_code.json": {
      "artifact_kind": "json",
      "schema": "review.schema.json",
      "sha256": "c525e8cdd6640944bcf5a9169a8eab75da78d52efc3ec31607b753792f914c3e",
      "bytes": 3813
    },
    "review_results.json": {
      "artifact_kind": "json",
      "schema": "review.schema.json",
      "sha256": "cb9eaf82d78685c37a0fe7afade1e7a19b30e9d5e8107a2877fd88c3c6f586ec",
      "bytes": 2865
    },
    "sessions.json": {
      "artifact_kind": "json",
      "schema": "sessions.schema.json",
      "sha256": "9e21e1f996876f06847efe640302ba367ae66610e2c366709677a641f9d31d36",
      "bytes": 158209
    },
    "summary.json": {
      "artifact_kind": "json",
      "schema": "summary.schema.json",
      "sha256": "4a0107fcba37034c37644d2c5792b8eabd80cb9b722e5629fbc1dd7caec827e7",
      "bytes": 141919
    }
  }
}
