{
  "contract_version": "1.0",
  "contestant": "10",
  "generated_at": "2026-08-16T09:28:41.670207+00:00",
  "tools": [
    "summarize.py",
    "extract_configs.py",
    "extract_sessions.py",
    "generate_agent_report.py",
    "record_agent_results.py"
  ],
  "artifacts": {
    "agent_scores.json": {
      "schema": "agent_scores.schema.json",
      "sha256": "c1ca8f4722b3c818b573e322cd146ad55ccdf3d9bfcc215eeff162554d399d6b",
      "bytes": 12831
    },
    "configs.json": {
      "schema": "configs.schema.json",
      "sha256": "9c05ed2568a1fe9af17568a53a17584d5da9b897e620624e1cdf277691152354",
      "bytes": 636588
    },
    "env_snapshot.json": {
      "schema": "env_snapshot.schema.json",
      "sha256": "a4c5bd8916525ceabdc9fe032bf63d3c6d851eddeab896d1646807891a8b798a",
      "bytes": 5029
    },
    "expenses.json": {
      "schema": "expenses.schema.json",
      "sha256": "f078c67910d17509f5aa54e3ee41cb5f5f2439e3dcc80f204623e550e5d8f1af",
      "bytes": 7572
    },
    "measurements.json": {
      "schema": "measurements.schema.json",
      "sha256": "28cbfc0dff2da474a24949afbd393e981438c663a5c7f3a14a62542c5a3c1e25",
      "bytes": 8812
    },
    "metadata.json": {
      "schema": "metadata.schema.json",
      "sha256": "8a757f0bb63d6f2a967d9e0e6c544698dab89590196dcb72cdb97fff3007396b",
      "bytes": 26333
    },
    "review_cfd.json": {
      "schema": "review.schema.json",
      "sha256": "1e295f66ea334a83df5769dbefa87f0c5290b40a97437c5a4fc7b93c36f67a5d",
      "bytes": 3112
    },
    "review_code.json": {
      "schema": "review.schema.json",
      "sha256": "bf39fd54c1f5469d0f344442bf154f267911c2006c11a3450509325a134c28cb",
      "bytes": 3129
    },
    "review_results.json": {
      "schema": "review.schema.json",
      "sha256": "3c76761fc232389a4daa49b8abc4ba6e804000ffbdfa5d7ad42844f03d3b5119",
      "bytes": 2342
    },
    "sessions.json": {
      "schema": "sessions.schema.json",
      "sha256": "df1d8f0f2c2bb75d4fc66f0b2eafddcf78f3a45d1988349b61994598c23ea5d0",
      "bytes": 42373
    },
    "summary.json": {
      "schema": "summary.schema.json",
      "sha256": "dfad051929fbcb4bb6a76832eb381181ae047e66f55f297d33ea7adde5f892b5",
      "bytes": 56591
    }
  }
}
