{
  "contract_version": "1.1",
  "contestant": "opus46-02",
  "generated_at": "2026-08-28T10:18:03.631900+00:00",
  "tools": [
    "summarize.py",
    "extract_configs.py",
    "extract_sessions.py",
    "generate_agent_report.py",
    "record_agent_results.py"
  ],
  "artifacts": {
    "agent_scores.json": {
      "artifact_kind": "json",
      "schema": "agent_scores.schema.json",
      "sha256": "ceb86a4bf79c59a1fd2e70062f5ceb69b0a4868ef3c6272c522332fb41e328df",
      "bytes": 10022
    },
    "configs.json": {
      "artifact_kind": "json",
      "schema": "configs.schema.json",
      "sha256": "2410814a38539c9c05ebba59615c44e2a13d1c3e7b00ac21fcb80a6b1bc6500f",
      "bytes": 658838
    },
    "env_snapshot.json": {
      "artifact_kind": "json",
      "schema": "env_snapshot.schema.json",
      "sha256": "2ea48e20a2a19002d1df293e869f75c3d3375696416e0ecb4c845dd3c8ef1cc6",
      "bytes": 5910
    },
    "expenses.json": {
      "artifact_kind": "json",
      "schema": "expenses.schema.json",
      "sha256": "51cc47bbeb35df52cf3541f82949366879cdb51e18e173c671a58a6080acf71d",
      "bytes": 13376
    },
    "measurements.json": {
      "artifact_kind": "json",
      "schema": "measurements.schema.json",
      "sha256": "4dda58e0fab3adaf78210ac984e12c356d60b00e845cd1c8ea21bfed8489cb4f",
      "bytes": 11346
    },
    "metadata.json": {
      "artifact_kind": "json",
      "schema": "metadata.schema.json",
      "sha256": "c00c32a76aafb1818174aff87d3e2d95cb9c6f403aaacee854d9d45ce64a4fea",
      "bytes": 39749
    },
    "report.pdf": {
      "artifact_kind": "binary",
      "schema": null,
      "sha256": "f2d52bb09f7dbbbe67fb0872690cc13cac1cdce7ad6662ff07903b99601d1254",
      "bytes": 437353,
      "media_type": "application/pdf"
    },
    "report_pdf.json": {
      "artifact_kind": "json",
      "schema": "report_pdf.schema.json",
      "sha256": "02731786e832123f24fbc2d99120a19e2f89c5008ee7d5e5c487796a50641e9a",
      "bytes": 1031
    },
    "review_cfd.json": {
      "artifact_kind": "json",
      "schema": "review.schema.json",
      "sha256": "37f80c01e777d2ffdcf1e7d32b347abecca0960e96b8dcc0c2e5d4cfe386c973",
      "bytes": 3042
    },
    "review_code.json": {
      "artifact_kind": "json",
      "schema": "review.schema.json",
      "sha256": "3418d39c4c4c492c0498c3c7f6ef9a14558c90826a0702e87486e58d050f1e15",
      "bytes": 2892
    },
    "review_results.json": {
      "artifact_kind": "json",
      "schema": "review.schema.json",
      "sha256": "91cce6213b5f47cade3001298b44a222da43a2322a2982c29154278bed183939",
      "bytes": 2216
    },
    "sessions.json": {
      "artifact_kind": "json",
      "schema": "sessions.schema.json",
      "sha256": "88551e23f4854532a2c8375ee93cc8995d4f5d58574aa14c2b4905f7e4df9d5a",
      "bytes": 20688
    },
    "summary.json": {
      "artifact_kind": "json",
      "schema": "summary.schema.json",
      "sha256": "811857ec2726d962e0245f3cbabd1fa25ce119ea071dfd865a2a998fa24ea730",
      "bytes": 79072
    }
  }
}
