{
  "contract_version": "1.1",
  "contestant": "sonnet46-01",
  "generated_at": "2026-08-28T03:04:55.309658+00:00",
  "tools": [
    "summarize.py",
    "extract_configs.py",
    "extract_sessions.py",
    "generate_agent_report.py",
    "record_agent_results.py"
  ],
  "artifacts": {
    "agent_scores.json": {
      "artifact_kind": "json",
      "schema": "agent_scores.schema.json",
      "sha256": "41b5d75aedfa45956860776da93eb389032db66e4100f4f30f68410120defc74",
      "bytes": 10079
    },
    "configs.json": {
      "artifact_kind": "json",
      "schema": "configs.schema.json",
      "sha256": "92ff5057747c71830bad87dfa853fe41fd39413be45b7c75f6c7bc5686420c21",
      "bytes": 666643
    },
    "env_snapshot.json": {
      "artifact_kind": "json",
      "schema": "env_snapshot.schema.json",
      "sha256": "5189aaa6e2b336a71f40c01513e2183494af5149e51b263599ca946dd5e1cee7",
      "bytes": 5914
    },
    "expenses.json": {
      "artifact_kind": "json",
      "schema": "expenses.schema.json",
      "sha256": "645d5a092a15453d2899e44a765d428d95df44ef60ae9f4de09cd6b36344472e",
      "bytes": 9945
    },
    "measurements.json": {
      "artifact_kind": "json",
      "schema": "measurements.schema.json",
      "sha256": "cda3982ced2dc9c4614249f91eb830a9bc7e231a85b276837c139fdeb2346feb",
      "bytes": 59159
    },
    "metadata.json": {
      "artifact_kind": "json",
      "schema": "metadata.schema.json",
      "sha256": "862a768e2e637248dc99e907934dded52bdb0036c515db1e6dc9e4e4f6bb4ed7",
      "bytes": 32100
    },
    "report.pdf": {
      "artifact_kind": "binary",
      "schema": null,
      "sha256": "cab4b113f5b5e1ddf72351d240b7d8645021659a9ea2ceb3a29026382d513b52",
      "bytes": 3762055,
      "media_type": "application/pdf"
    },
    "report_pdf.json": {
      "artifact_kind": "json",
      "schema": "report_pdf.schema.json",
      "sha256": "79706a6061888ba7879c48fdbdb73051e41a4faa0a7b85c8fdc1adf89ee50a8b",
      "bytes": 1186
    },
    "review_cfd.json": {
      "artifact_kind": "json",
      "schema": "review.schema.json",
      "sha256": "a23b877c1bf445a58b62e2e0300ff89e5dda465e38f41ac6073b01f64e0812ef",
      "bytes": 3155
    },
    "review_code.json": {
      "artifact_kind": "json",
      "schema": "review.schema.json",
      "sha256": "a866b5a36a6a66752146ba17dc9d0ba6d1e2f6e78afe3a32cfd8968599f37525",
      "bytes": 2932
    },
    "review_results.json": {
      "artifact_kind": "json",
      "schema": "review.schema.json",
      "sha256": "eca31a072fcc814bee2c99f1757b4db991b03fb6bb0b25db37235eb5fe4bc9f0",
      "bytes": 2152
    },
    "sessions.json": {
      "artifact_kind": "json",
      "schema": "sessions.schema.json",
      "sha256": "a206c3007495910302e75f9a581def95c1ac18175a9e3c9b597092db92071a2b",
      "bytes": 76408
    },
    "summary.json": {
      "artifact_kind": "json",
      "schema": "summary.schema.json",
      "sha256": "1677291932c017ccee58aa934913a686a588742d4587cb6528ba9dffa2e9b5a6",
      "bytes": 117670
    }
  }
}
