{
  "contract_version": "1.1",
  "contestant": "glm53-02",
  "generated_at": "2026-09-05T04:47:00.510624+00:00",
  "tools": [
    "summarize.py",
    "extract_configs.py",
    "extract_sessions.py",
    "generate_agent_report.py",
    "record_agent_results.py"
  ],
  "artifacts": {
    "agent_scores.json": {
      "artifact_kind": "json",
      "schema": "agent_scores.schema.json",
      "sha256": "8a096bca200143347f238edd0b7a46ee52569c756c9389435e6eed5392d4d3c7",
      "bytes": 17175
    },
    "configs.json": {
      "artifact_kind": "json",
      "schema": "configs.schema.json",
      "sha256": "9244c6b9a6caf2ba7cea885c123e7ebca902091e4d40bac5643e770d8c386494",
      "bytes": 682877
    },
    "env_snapshot.json": {
      "artifact_kind": "json",
      "schema": "env_snapshot.schema.json",
      "sha256": "3cf32749514d642f4f8d4bba0e050baff57f6f88d8a29ee9a9195316e37dac76",
      "bytes": 5911
    },
    "expenses.json": {
      "artifact_kind": "json",
      "schema": "expenses.schema.json",
      "sha256": "aa70128dcd8ae24421cdbbfdddaddb25ff5ced6a6f6a390091024af8cca54eb0",
      "bytes": 5880
    },
    "measurements.json": {
      "artifact_kind": "json",
      "schema": "measurements.schema.json",
      "sha256": "7f40323e9eea0bbe2153ee753a8f1f67d355aab3cbda37dd4702754f9b45a51d",
      "bytes": 7470
    },
    "metadata.json": {
      "artifact_kind": "json",
      "schema": "metadata.schema.json",
      "sha256": "8e75d305d4050967fbb90136c59656f3dfb824e68cacdd0006a1d11f4d7cf576",
      "bytes": 23259
    },
    "report.pdf": {
      "artifact_kind": "binary",
      "schema": null,
      "sha256": "d69b0785f55386c3999f6f8355fb12abdc2fd60914d188b3efcdc7a7f92ed44f",
      "bytes": 2738555,
      "media_type": "application/pdf"
    },
    "report_pdf.json": {
      "artifact_kind": "json",
      "schema": "report_pdf.schema.json",
      "sha256": "605a76bd27563734eff50c31536e8beff49e9d83cf08e6995285a73363643c1b",
      "bytes": 1024
    },
    "review_cfd.json": {
      "artifact_kind": "json",
      "schema": "review.schema.json",
      "sha256": "cb60d235900a9e9643c1a6072c405c657a9bbaa6002e35633d7c706c9b341e91",
      "bytes": 4750
    },
    "review_code.json": {
      "artifact_kind": "json",
      "schema": "review.schema.json",
      "sha256": "2dac7f23c45d5555e899a8f233dffd318314a4a8c3b75681ddc1cb913655b9ec",
      "bytes": 4245
    },
    "review_results.json": {
      "artifact_kind": "json",
      "schema": "review.schema.json",
      "sha256": "148cdfb6a37386de788701453037e7b3b04a258b960172737a67374c54557e27",
      "bytes": 3201
    },
    "sessions.json": {
      "artifact_kind": "json",
      "schema": "sessions.schema.json",
      "sha256": "efd847553da9cc91b41f10e791c9c2892589a0942cdc8a6a7602c3f8356206a6",
      "bytes": 27161
    },
    "summary.json": {
      "artifact_kind": "json",
      "schema": "summary.schema.json",
      "sha256": "6aaa079571c0216cdff0973ee89ab45d2dc78e0053f64fb8591e9777e10d17b9",
      "bytes": 54324
    }
  }
}
