{
  "contract_version": "1.1",
  "contestant": "06",
  "generated_at": "2026-08-28T03:24:56.810729+00:00",
  "tools": [
    "summarize.py",
    "extract_configs.py",
    "extract_sessions.py",
    "generate_agent_report.py",
    "record_agent_results.py"
  ],
  "artifacts": {
    "agent_scores.json": {
      "artifact_kind": "json",
      "schema": "agent_scores.schema.json",
      "sha256": "0726201f0a525707da9e01ebd93fa294e5f9a002f8fac9e3392d4adfbbd867ca",
      "bytes": 12975
    },
    "configs.json": {
      "artifact_kind": "json",
      "schema": "configs.schema.json",
      "sha256": "9eca1749d415158e20297e19a636c973eca069210fc71cd10a80f9edd9bd7c3b",
      "bytes": 665421
    },
    "env_snapshot.json": {
      "artifact_kind": "json",
      "schema": "env_snapshot.schema.json",
      "sha256": "c1bc7439fa1c852c15e4ec90dd0efe16baa2ac321312efacfb855d5da745c7a6",
      "bytes": 5895
    },
    "expenses.json": {
      "artifact_kind": "json",
      "schema": "expenses.schema.json",
      "sha256": "9345d6d1ef14bdd49149c40ee01b4b864df6869e3a8144b74f5a21204a98bdd1",
      "bytes": 7715
    },
    "measurements.json": {
      "artifact_kind": "json",
      "schema": "measurements.schema.json",
      "sha256": "612747d155427ac8bc0dd1a91d75f21adfd80fbfd47846e7fdb5156ecbf2ba2b",
      "bytes": 6068
    },
    "metadata.json": {
      "artifact_kind": "json",
      "schema": "metadata.schema.json",
      "sha256": "4635363353aa3a50e306cde91dd0d8cf802122f8502504e70100b25e85b016a8",
      "bytes": 27180
    },
    "report.pdf": {
      "artifact_kind": "binary",
      "schema": null,
      "sha256": "0be615d1ca911e103ab0e47f06ad4488d36cfa9f15d0a646b364ee0abed6cc61",
      "bytes": 2628287,
      "media_type": "application/pdf"
    },
    "report_pdf.json": {
      "artifact_kind": "json",
      "schema": "report_pdf.schema.json",
      "sha256": "7300fcd83b661d60d5618372e8b1019e67a12024538eb9e247ebcf97089a9257",
      "bytes": 1169
    },
    "review_cfd.json": {
      "artifact_kind": "json",
      "schema": "review.schema.json",
      "sha256": "a5104a811c855e2c1b096e53729a08bb3698743e5031ead128fa58ac42adddd6",
      "bytes": 3534
    },
    "review_code.json": {
      "artifact_kind": "json",
      "schema": "review.schema.json",
      "sha256": "d1df94c9ceeb9d6acb364b0297af03f6ec0488c684a4a08c63cabcff829d8364",
      "bytes": 3368
    },
    "review_results.json": {
      "artifact_kind": "json",
      "schema": "review.schema.json",
      "sha256": "3745546e67345a9fa597f5e1e0ea0986f4798965a7ee9f869b2334c79809888a",
      "bytes": 2579
    },
    "sessions.json": {
      "artifact_kind": "json",
      "schema": "sessions.schema.json",
      "sha256": "69720dfdf0e5fb05a23f59e64b6be59939221dbdebb1ef00082c2838587263ec",
      "bytes": 102543
    },
    "summary.json": {
      "artifact_kind": "json",
      "schema": "summary.schema.json",
      "sha256": "9ab8725353a7d61ff8178acccb1c5f9e7cd68f5a218210908527accd6db6d398",
      "bytes": 56315
    }
  }
}
