{
  "contract_version": "1.0",
  "contestant": "codex_glm52_01_1307c9",
  "generated_at": "2026-08-13T12:29:16.965326+00:00",
  "tools": [
    "summarize.py",
    "extract_configs.py",
    "extract_sessions.py",
    "generate_agent_report.py",
    "record_agent_results.py"
  ],
  "artifacts": {
    "agent_scores.json": {
      "schema": "agent_scores.schema.json",
      "sha256": "07f35df89ff541a885f7fcc615e43ef6f29fa40d24d6b34b9f9cd1d7fa95d7f9",
      "bytes": 11814
    },
    "configs.json": {
      "schema": "configs.schema.json",
      "sha256": "34eaa3dbd30b909afd56a24eda8ad38fd68a2fb7732b650b4ff08979b98f8615",
      "bytes": 62255
    },
    "env_snapshot.json": {
      "schema": "env_snapshot.schema.json",
      "sha256": "dab1a3b191859880a5380d732b50a86f4f76e9bd05e4575937844e1b73d824fc",
      "bytes": 5730
    },
    "expenses.json": {
      "schema": "expenses.schema.json",
      "sha256": "4af351b7a65ac424a02c4f5f55333515b7162994ccdec4894a950aaa25999b1d",
      "bytes": 3764
    },
    "measurements.json": {
      "schema": "measurements.schema.json",
      "sha256": "8212026d51bfcc80ef1487476de54d494338e665f6cb668ab71ef74596231c05",
      "bytes": 5474
    },
    "metadata.json": {
      "schema": "metadata.schema.json",
      "sha256": "609e36595db1c68ed761aa5cdb78ee0b835e8370e72190fffab69f76b2725aeb",
      "bytes": 13394
    },
    "review_cfd.json": {
      "schema": "review.schema.json",
      "sha256": "77733933452757067e65f0a3ea7d0cd12295712d05c0096a390ec65072a2576c",
      "bytes": 2583
    },
    "review_code.json": {
      "schema": "review.schema.json",
      "sha256": "3c25a69ab2a7d06b14dcf4b7156d79d5a62a5d20baa2b068e3bbc7bae0135d16",
      "bytes": 3087
    },
    "review_results.json": {
      "schema": "review.schema.json",
      "sha256": "b3b7bb242b8b1e66a554eaa97e4b6d0d635ad6d496cac5321c16b04c7f3a7e08",
      "bytes": 2139
    },
    "sessions.json": {
      "schema": "sessions.schema.json",
      "sha256": "a28460e79666b04207cc9b24dd223e574b8d6b7d6a915dce2dc19a387d3f087d",
      "bytes": 12933
    },
    "summary.json": {
      "schema": "summary.schema.json",
      "sha256": "dc4d5e674e35cabb467aafd1f34a6aaeeb0d22717fe02a6b35552f8f98999a76",
      "bytes": 47504
    }
  }
}
