{
  "contract_version": "1.0",
  "contestant": "01",
  "generated_at": "2026-08-14T08:08:03.161666+00:00",
  "tools": [
    "summarize.py",
    "extract_configs.py",
    "extract_sessions.py",
    "generate_agent_report.py",
    "record_agent_results.py"
  ],
  "artifacts": {
    "agent_scores.json": {
      "schema": "agent_scores.schema.json",
      "sha256": "09a529e584b2c3cfab6f9876f9a4676c718c8fb13665e25ae617139041a4adbf",
      "bytes": 17798
    },
    "configs.json": {
      "schema": "configs.schema.json",
      "sha256": "33a8e2e30f078fadf88fe19bc20b58bb20860ef4ece2720d78fb3b95f478d142",
      "bytes": 51252
    },
    "env_snapshot.json": {
      "schema": "env_snapshot.schema.json",
      "sha256": "936e39f6a2187e7ab6ef6002cfc729ba3d5cb5a1224e4dea7216f054cb827e0c",
      "bytes": 5772
    },
    "expenses.json": {
      "schema": "expenses.schema.json",
      "sha256": "973d1baabd7c6e5e4559bc289d18a811bc95d30b04aafaaadb94a50f6dc0f653",
      "bytes": 3091
    },
    "measurements.json": {
      "schema": "measurements.schema.json",
      "sha256": "3bc646c91f17d58345296a2018ce19d4caca610be641d1917c7246f5a2730f7a",
      "bytes": 5035
    },
    "metadata.json": {
      "schema": "metadata.schema.json",
      "sha256": "f826d82939585285a1cf4a1906aedd4bc0beb713764934f8b8737f18b59d24a5",
      "bytes": 6462
    },
    "review_cfd.json": {
      "schema": "review.schema.json",
      "sha256": "b5484cc50b133cb57a95c5b0753a5672fa86a0bb8c6999f2d0c2b2c5d5ca3a11",
      "bytes": 3858
    },
    "review_code.json": {
      "schema": "review.schema.json",
      "sha256": "2f38cdcbb8666128c053c444bc86de09ee1388b9884fc059ff25081edb784c81",
      "bytes": 3608
    },
    "review_results.json": {
      "schema": "review.schema.json",
      "sha256": "669a409eebf51075fff16534702f6ab2087a93837cfbd48fd9a6dac045aa1477",
      "bytes": 2714
    },
    "sessions.json": {
      "schema": "sessions.schema.json",
      "sha256": "3775fb26240befd4854e8b47d04c3cb8ee18df2e6ced5f9add51fded1ad37872",
      "bytes": 60921
    },
    "summary.json": {
      "schema": "summary.schema.json",
      "sha256": "6f1a3da599ca3ca5f76c8d7e8abbfad41bfc39e69ae8592feafae6c7ba352350",
      "bytes": 28332
    }
  }
}
