{
  "contract_version": "1.0",
  "contestant": "omo_slim_dsv4_04_d9ebd4",
  "generated_at": "2026-08-14T15:29:39.814739+00:00",
  "tools": [
    "summarize.py",
    "extract_configs.py",
    "extract_sessions.py",
    "generate_agent_report.py",
    "record_agent_results.py"
  ],
  "artifacts": {
    "agent_scores.json": {
      "schema": "agent_scores.schema.json",
      "sha256": "782e637d0a03978d80e7401dd2cabf46649f637e4a6a2b088c598ef3e9add534",
      "bytes": 17821
    },
    "configs.json": {
      "schema": "configs.schema.json",
      "sha256": "10d90ed9bd7aa349a1e66c38188ed2d3001c7be50b7f08c7d43045d961c4f4b4",
      "bytes": 51560
    },
    "env_snapshot.json": {
      "schema": "env_snapshot.schema.json",
      "sha256": "545b3df768d1a043d88fc9e9486f1e923e6a6c938fcf17602e21b3376e11a3a5",
      "bytes": 5854
    },
    "expenses.json": {
      "schema": "expenses.schema.json",
      "sha256": "bfe0766e189b0b3dff80f6bd52c23b124a6ce7a083ae1503a6cb0093d5914a03",
      "bytes": 10682
    },
    "measurements.json": {
      "schema": "measurements.schema.json",
      "sha256": "23826517aac1fea49879a6caa0682137702045565d92511154c8ba9d40a4e0cf",
      "bytes": 394
    },
    "metadata.json": {
      "schema": "metadata.schema.json",
      "sha256": "5e523d09f393fdc4564e378e4a3ab365af41d7fbd34759f7b3e30ceeebdefe2a",
      "bytes": 46764
    },
    "review_cfd.json": {
      "schema": "review.schema.json",
      "sha256": "a92eecc8fae48ce0e8b87df2130b5fed76090efc932c5eeeacbcedc99fcc5fc1",
      "bytes": 4114
    },
    "review_code.json": {
      "schema": "review.schema.json",
      "sha256": "04a6409599ca2125f2f0296b1f31673934a29e97dec3ed6e0924b118f9a089c1",
      "bytes": 3752
    },
    "review_results.json": {
      "schema": "review.schema.json",
      "sha256": "45b150818487d7885bcabaa8e3d8c221244b614f6ac03bd014fd85606c90b38a",
      "bytes": 2332
    },
    "sessions.json": {
      "schema": "sessions.schema.json",
      "sha256": "a92a504dc37070ecd3af884be530fb6919844ec645965cdc73888bb8c22a0999",
      "bytes": 41297
    },
    "summary.json": {
      "schema": "summary.schema.json",
      "sha256": "b5851bca7aeae0ca2f7e79a14d8ace5c7c10fb7e2d52cf88ae6632f5b4074695",
      "bytes": 73251
    }
  }
}
