{
  "contract_version": "1.1",
  "contestant": "sonnet46-02",
  "generated_at": "2026-08-28T02:20:58.819958+00:00",
  "tools": [
    "summarize.py",
    "extract_configs.py",
    "extract_sessions.py",
    "generate_agent_report.py",
    "record_agent_results.py"
  ],
  "artifacts": {
    "agent_scores.json": {
      "artifact_kind": "json",
      "schema": "agent_scores.schema.json",
      "sha256": "c62119d96b8bb523b9a89699ecc1785ed8666e57e6827221742ba6d425304e4e",
      "bytes": 10960
    },
    "configs.json": {
      "artifact_kind": "json",
      "schema": "configs.schema.json",
      "sha256": "c1748168bc9d7953b1d9867469e1c3f24961e01a77b8c1453133798cb3dcad47",
      "bytes": 666457
    },
    "env_snapshot.json": {
      "artifact_kind": "json",
      "schema": "env_snapshot.schema.json",
      "sha256": "8b2f65779a7554026019b7cbf3144b56ed14bf6d475186d7593b6e7e06f13c7b",
      "bytes": 5914
    },
    "expenses.json": {
      "artifact_kind": "json",
      "schema": "expenses.schema.json",
      "sha256": "05413a6cde3b826e67ae1d5d886f08e798d50ee9af50cf7c58029e3a45f3bf9b",
      "bytes": 3824
    },
    "measurements.json": {
      "artifact_kind": "json",
      "schema": "measurements.schema.json",
      "sha256": "a349b8d14e6d95ff54a5f5d9ece3791f9805a48510bdbafa3fe6a6ded1147c6a",
      "bytes": 26118
    },
    "metadata.json": {
      "artifact_kind": "json",
      "schema": "metadata.schema.json",
      "sha256": "2261ec6d671759dfb07e139f67176fb59073ec16d472cf5c54c072744c836e34",
      "bytes": 17055
    },
    "report.pdf": {
      "artifact_kind": "binary",
      "schema": null,
      "sha256": "868e27ec9715a4c877d9ec7a8bd467aa1472cfeb8fc21e00e7b64f809c2b015c",
      "bytes": 5082501,
      "media_type": "application/pdf"
    },
    "report_pdf.json": {
      "artifact_kind": "json",
      "schema": "report_pdf.schema.json",
      "sha256": "35f54ca8e8ade59758048648fdf518b01b042f6657c35c670a36c29cf79f328a",
      "bytes": 1265
    },
    "review_cfd.json": {
      "artifact_kind": "json",
      "schema": "review.schema.json",
      "sha256": "ff66ea5655928d97e3485b2f50d070aa953d301947886f85a4ef56b5e24cd059",
      "bytes": 3216
    },
    "review_code.json": {
      "artifact_kind": "json",
      "schema": "review.schema.json",
      "sha256": "b6ba028dd9ec2f2c63e41a7cde0e362c1f2d7a4adc8b3a8295e8609725b5bd49",
      "bytes": 2971
    },
    "review_results.json": {
      "artifact_kind": "json",
      "schema": "review.schema.json",
      "sha256": "32c82c9c98117919536ac0909f1faaa297d6725e57685837c2c9e534e92a6a7b",
      "bytes": 2245
    },
    "sessions.json": {
      "artifact_kind": "json",
      "schema": "sessions.schema.json",
      "sha256": "b5180979a3ecef1eb28fbffb6d9431518d876afb9f565da16a4e033f23b6bd85",
      "bytes": 42900
    },
    "summary.json": {
      "artifact_kind": "json",
      "schema": "summary.schema.json",
      "sha256": "92fed6e86158e3360742bcd68b26aab1815922d473c474e9c56ac029ed55108a",
      "bytes": 61110
    }
  }
}
