{
  "contract_version": "1.1",
  "contestant": "06",
  "generated_at": "2026-08-28T02:21:56.728718+00:00",
  "tools": [
    "summarize.py",
    "extract_configs.py",
    "extract_sessions.py",
    "generate_agent_report.py",
    "record_agent_results.py"
  ],
  "artifacts": {
    "agent_scores.json": {
      "artifact_kind": "json",
      "schema": "agent_scores.schema.json",
      "sha256": "a0961b9ebdeeca42228f6fed8bbd14f5fd1d3de389af2555102b5eed587be52b",
      "bytes": 10097
    },
    "configs.json": {
      "artifact_kind": "json",
      "schema": "configs.schema.json",
      "sha256": "96b76ecfe9cca8dca2d15ce756d6237dad21e0f2bf906ffd40d45c77341bb6ae",
      "bytes": 53068
    },
    "env_snapshot.json": {
      "artifact_kind": "json",
      "schema": "env_snapshot.schema.json",
      "sha256": "23d330a1371303705bb7cca296ce9e4491a391f752abde4024727fd8a8956b99",
      "bytes": 5863
    },
    "expenses.json": {
      "artifact_kind": "json",
      "schema": "expenses.schema.json",
      "sha256": "370dd952f0699c429dbd4138ad39e0b96529c34e3580258c6756ad8d87c90afe",
      "bytes": 3187
    },
    "measurements.json": {
      "artifact_kind": "json",
      "schema": "measurements.schema.json",
      "sha256": "d9d5b4a90a1e120635c99a756f80a5e1f4135fef7a81cfcf5504d8e763c33288",
      "bytes": 6632
    },
    "metadata.json": {
      "artifact_kind": "json",
      "schema": "metadata.schema.json",
      "sha256": "95c6ef16c39beeefff27b787a280b5bc05af79043f8ff02326f93392e4417557",
      "bytes": 8184
    },
    "report_pdf.json": {
      "artifact_kind": "json",
      "schema": "report_pdf.schema.json",
      "sha256": "556341b2137a83720cc469f51401651e01b12f50fcfcde45e8e5d24938f7a2a9",
      "bytes": 621
    },
    "review_cfd.json": {
      "artifact_kind": "json",
      "schema": "review.schema.json",
      "sha256": "1de74d7ead7ac51dd9ce6433a2d280108aa6b160e569af395667a349f47aeed9",
      "bytes": 3048
    },
    "review_code.json": {
      "artifact_kind": "json",
      "schema": "review.schema.json",
      "sha256": "c818654931d6d91b194427b1dbd6d5ab9e35957f870a995218b6aa922a788b07",
      "bytes": 2971
    },
    "review_results.json": {
      "artifact_kind": "json",
      "schema": "review.schema.json",
      "sha256": "00f68abe9a4738c74495eac96493acf939a0f032b686437d37fcc45acec86379",
      "bytes": 2306
    },
    "sessions.json": {
      "artifact_kind": "json",
      "schema": "sessions.schema.json",
      "sha256": "42ae6c356e6879c2c079fcc0253ddde6c4687b2e388b0ad9d1cf7874a37c2a23",
      "bytes": 26043
    },
    "summary.json": {
      "artifact_kind": "json",
      "schema": "summary.schema.json",
      "sha256": "d8ee5e7bf63a173b6d44bb3d684fd43c5eec789bac117eb1eca5640ec89f4e9c",
      "bytes": 29876
    }
  }
}
